{
  "version": 1,
  "name": "default-foundation",
  "target": "local",
  "runtime": { "engine": "foundation" },
  "steps": [
    { "id": "tokenize", "uses": "tokenize" },
    {
      "id": "pretrain",
      "uses": "pretrain",
      "with": {
        "tokenizer": { "from": "tokenize.tokenizer" },
        "depth": 2,
        "steps": 2,
        "batchSize": 2,
        "sequenceLength": 64
      }
    },
    {
      "id": "bpb",
      "uses": "evaluate",
      "with": { "model": { "from": "pretrain.model" }, "evaluator": "bpb" }
    },
    {
      "id": "sft",
      "uses": "finetune",
      "with": { "model": { "from": "pretrain.model" }, "steps": 2, "batchSize": 1 }
    },
    {
      "id": "chat",
      "uses": "evaluate",
      "with": { "model": { "from": "sft.model" }, "evaluator": "chat" }
    },
    {
      "id": "infer",
      "uses": "evaluate",
      "with": { "model": { "from": "sft.model" }, "evaluator": "inference" }
    }
  ]
}
