{
  "version": 1,
  "name": "default-cloud",
  "target": "cloud",
  "steps": [
    { "id": "baseline", "uses": "evaluate", "with": { "model": "base", "evaluator": "behavior" } },
    { "id": "train", "uses": "train" },
    { "id": "candidate", "uses": "evaluate", "with": { "model": { "from": "train.model" }, "evaluator": "behavior" } },
    { "id": "compare", "uses": "compare", "with": { "before": { "from": "baseline.report" }, "after": { "from": "candidate.report" } } }
  ]
}
